<?xml version="1.0" encoding="UTF-8"?>
<!--
To change this license header, choose License Headers in Project Properties.
To change this template file, choose Tools | Templates
and open the template in the editor.
-->


<ns1:grid
    xmlns:xsi='http://www.w3.org/2001/XMLSchema-instance'
    xmlns:ns1='http://liktek.fr/likacoustik/grid'
    xsi:schemaLocation='http://liktek.fr/likacoustik/grid file:/Users/gauthierlyan/NetBeansProjects/LikacoustikXML/src/java/grid.xsd'>
    
    <ns1:measure>
        <ns1:ref>C-T3</ns1:ref>
        <ns1:measureType>Isolement</ns1:measureType>
        <ns1:measureNature>Horizontal</ns1:measureNature>
        <ns1:origin>
            <ns1:building>Tour Eiffel</ns1:building>
            <ns1:floor>2</ns1:floor>
            <ns1:flat>Chez Roger</ns1:flat>
            <ns1:room>Salle Ã  manger</ns1:room>
        </ns1:origin>
        <ns1:reception>
            <ns1:building>Tour Eiffel</ns1:building>
            <ns1:floor>2</ns1:floor>
            <ns1:flat>Chez Roger</ns1:flat>
            <ns1:room>Salle de bain</ns1:room>
        </ns1:reception>
        <ns1:equipment>Mesureur acoustique classique</ns1:equipment>
        <ns1:indice>Ct, dnd</ns1:indice>
        <ns1:value>
            <ns1:required>30</ns1:required>
            <ns1:measured>37</ns1:measured>
        </ns1:value>
        <ns1:constat>C</ns1:constat>
        <ns1:comment>RAS</ns1:comment>
    </ns1:measure>
    
    
    <ns1:measure>
        <ns1:ref>C-T1</ns1:ref>
        <ns1:measureType>Bruit d'impact</ns1:measureType>
        <ns1:measureNature>Vertical</ns1:measureNature>
        <ns1:origin>
            <ns1:building>Tour Montparnasse</ns1:building>
            <ns1:floor>30</ns1:floor>
            <ns1:flat>Chez Paul</ns1:flat>
            <ns1:room>Chambre 1</ns1:room>
        </ns1:origin>
        <ns1:reception>
            <ns1:building>Tour Montparnasse</ns1:building>
            <ns1:floor>29</ns1:floor>
            <ns1:flat>Chez Simone</ns1:flat>
            <ns1:room>Cuisine</ns1:room>
        </ns1:reception>
        <ns1:equipment>Mesureur acoustique classique</ns1:equipment>
        <ns1:indice>Ct, dnd</ns1:indice>
        <ns1:value>
            <ns1:required>40</ns1:required>
            <ns1:measured>30</ns1:measured>
        </ns1:value>
        <ns1:constat>NC</ns1:constat>
        <ns1:comment>Bruit trop peu ressenti</ns1:comment>
    </ns1:measure>
    
    <ns1:measure>
        <ns1:ref>C-R12</ns1:ref>
        <ns1:measureType>Isolement</ns1:measureType>
        <ns1:measureNature>Vertical</ns1:measureNature>
        <ns1:origin>
            <ns1:building>ISTIC</ns1:building>
            <ns1:floor>2</ns1:floor>
            <ns1:flat></ns1:flat>
            <ns1:room>Salle 213</ns1:room>
        </ns1:origin>
        <ns1:reception>
            <ns1:building>ISTIC</ns1:building>
            <ns1:floor>2</ns1:floor>
            <ns1:flat></ns1:flat>
            <ns1:room>Salle 215</ns1:room>
        </ns1:reception>
        <ns1:equipment>Mesureur acoustique classique</ns1:equipment>
        <ns1:indice>Ct, dnd</ns1:indice>
        <ns1:value>
            <ns1:required>40</ns1:required>
            <ns1:measured>56</ns1:measured>
        </ns1:value>
        <ns1:constat>C</ns1:constat>
        <ns1:comment>RAS</ns1:comment>
    </ns1:measure>  
    

</ns1:grid>
